### ISSUE TITLE
[Missing SNMP Traps Profile]

### ISSUE THREAD

**Issue by benher-cherla-db** [kentik/snmp-profiles#402]
[NOTE]: # ( ^^ Pure flash array - FA-X50R2 ^^ )

Device Vendor:  Pure Flash Array

Device Model: FA-X50R2

We needs to have Pure Flash Array profile in our ktranslate image. Below is the MIB information. 
Please let us know if you require any further information to completed this activity. 

-- **********************************************************
-- Copyright (c) 2019 Pure Storage, Inc. All rights reserved.
-- This source code contains confidential information and trade secrets
-- of Pure Storage, Inc. Use, disclosure or reproduction is strictly
-- prohibited without the prior express written permission of Pure Storage, Inc.
-- Versions:
--   1.0 (2012-09-21)
--     Purestorage Flash Array SNMP Trap v2c | v3 support
--   1.1 (2013-08-20)
--     Separate reminder from severity.
-- **********************************************************

PURESTORAGE-MIB DEFINITIONS ::= BEGIN

IMPORTS
    MODULE-IDENTITY,
    OBJECT-IDENTITY,
    NOTIFICATION-TYPE,
    OBJECT-TYPE,
    Integer32,
    enterprises
        FROM SNMPv2-SMI
    OBJECT-GROUP
        FROM SNMPv2-CONF;

purestorage MODULE-IDENTITY
    LAST-UPDATED "201209200000Z"
    ORGANIZATION "Pure Storage, Inc"
    CONTACT-INFO
        "http://www.purestorage.com/ | support@purestorage.com"
    DESCRIPTION
        "Pure Storage v2c/v3 SNMP MIB"
    REVISION "201209200000Z"
    DESCRIPTION
        "Pure Storage Flash Array MIB"
    ::= { enterprises 40482 }

pureSystem OBJECT-IDENTITY
    STATUS  current
    DESCRIPTION
        "Parent of all managed objects relating to system software identification"
    ::= { purestorage 1 }

pureNotifications OBJECT-IDENTITY
    STATUS  current
    DESCRIPTION
        "Parent of all notifications (traps, informs)"
    ::= { purestorage 2 }

pureObjects OBJECT-IDENTITY
    STATUS  current
    DESCRIPTION
        "Parent of all objects"
    ::= { purestorage 3 }

purePerformance OBJECT-IDENTITY
    STATUS  current
    DESCRIPTION
        "Parent of all performance data"
    ::= { purestorage 4 }

pureExperimental OBJECT-IDENTITY
    STATUS  current
    DESCRIPTION
        "Used for product testing and development"
    ::= { purestorage 700 }

pureProductName OBJECT-TYPE
    SYNTAX OCTET STRING
    MAX-ACCESS accessible-for-notify
    STATUS current
    DESCRIPTION
        "Pure Storage Product Name"
    ::= {pureObjects 1}

pureProductVersion OBJECT-TYPE
    SYNTAX OCTET STRING
    MAX-ACCESS accessible-for-notify
    STATUS current
    DESCRIPTION
        "Pure Storage Product Version"
    ::= {pureObjects 2}

pureHost OBJECT-TYPE
    SYNTAX OCTET STRING
    MAX-ACCESS accessible-for-notify
    STATUS current
    DESCRIPTION
        "Pure Storage Hostname"
    ::= {pureObjects 3}

pureAlertCode OBJECT-TYPE
    SYNTAX Integer32
    MAX-ACCESS accessible-for-notify
    STATUS current
    DESCRIPTION
        "Alert Code"
    ::= {pureObjects 4}

pureAlertSubject OBJECT-TYPE
    SYNTAX OCTET STRING
    MAX-ACCESS accessible-for-notify
    STATUS current
    DESCRIPTION
        "Alert Subject"
    ::= {pureObjects 5}

pureAlertBody OBJECT-TYPE
    SYNTAX OCTET STRING
    MAX-ACCESS accessible-for-notify
    STATUS current
    DESCRIPTION
        "Alert Body or Extra Information"
    ::= {pureObjects 6}

pureAlertReminder OBJECT-TYPE
    SYNTAX Integer32
    MAX-ACCESS accessible-for-notify
    STATUS current
    DESCRIPTION
        "If alert is a reminder, true(1) or false(2)"
    ::= {pureObjects 7}

pureArrayReadBandwidth OBJECT-TYPE
    SYNTAX Integer32
    UNITS  "B/s"
    MAX-ACCESS read-only
    STATUS current
    DESCRIPTION
        "Array Read Bandwidth (bytes/s)"
    ::= {purePerformance 1}

pureArrayWriteBandwidth OBJECT-TYPE
    SYNTAX Integer32
    UNITS  "B/s"
    MAX-ACCESS read-only
    STATUS current
    DESCRIPTION
        "Array Write Bandwidth (bytes/s)"
    ::= {purePerformance 2}

pureArrayReadIOPS OBJECT-TYPE
    SYNTAX Integer32
    UNITS  "op/s"
    MAX-ACCESS read-only
    STATUS current
    DESCRIPTION
        "Array Read IOPS (op/s)"
    ::= {purePerformance 3}

pureArrayWriteIOPS OBJECT-TYPE
    SYNTAX Integer32
    UNITS  "op/s"
    MAX-ACCESS read-only
    STATUS current
    DESCRIPTION
        "Array Write IOPS (op/s)"
    ::= {purePerformance 4}

pureArrayReadLatency OBJECT-TYPE
    SYNTAX Integer32
    UNITS  "us/op"
    MAX-ACCESS read-only
    STATUS current
    DESCRIPTION
        "Array Read Latency (us/op)"
    ::= {purePerformance 5}

pureArrayWriteLatency OBJECT-TYPE
    SYNTAX Integer32
    UNITS  "us/op"
    MAX-ACCESS read-only
    STATUS current
    DESCRIPTION
        "Array Write Latency (us/op)"
    ::= {purePerformance 6}

pureInfoTrap NOTIFICATION-TYPE
    OBJECTS { pureProductName, pureProductVersion, pureHost, pureAlertCode, pureAlertSubject, pureAlertBody }
    STATUS current
    DESCRIPTION
        "Info Trap"
    ::= { pureNotifications 50}

pureWarningTrap NOTIFICATION-TYPE
    OBJECTS { pureProductName, pureProductVersion, pureHost, pureAlertCode, pureAlertSubject, pureAlertBody }
    STATUS current
    DESCRIPTION
        "Warning Trap"
    ::= { pureNotifications 51}

pureCriticalTrap NOTIFICATION-TYPE
    OBJECTS { pureProductName, pureProductVersion, pureHost, pureAlertCode, pureAlertSubject, pureAlertBody }
    STATUS current
    DESCRIPTION
        "Critical Trap"
    ::= { pureNotifications 52}

END

**Comment by thezackm** [comment]
@benher-cherla-db - are you able to supply a `.pcap` file from a `tcpdump` capture of a sample of these traps so we can validate their format?

Example of creating PCAP with the `tcpdump` utility:
```
sudo tcpdump -s 0 port 162 -w snmpTraps.pcap
```

**Comment by benher-cherla-db** [comment]
Hi Zack Mutchler,

Find the capture of the Pure Flash Array traps below:

[root@fraitdbox01096 devbox]# tcpdump -i ens160 src host 10.245.83.130 and port 162
tcpdump: verbose output suppressed, use -v or -vv for full protocol decode
listening on ens160, link-type EN10MB (Ethernet), capture size 262144 bytes
14:29:17.500766 IP loninengpurem51c1.uk.db.com.33842 > fraitdbox01096.de.db.com.snmptrap:  V2Trap(251)  system.sysUpTime.0=1534364339 S:1.1.4.1.0=E:40482.2.50 E:40482.3.1="Flash Array" E:40482.3.2="6.1.14" E:40482.3.3="loninengpurem51-ct1" E:40482.3.4=0 E:40482.3.5="PureStorage Test Trap" E:40482.3.6="PureStorage Test Body" E:40482.3.7=2
14:29:20.875702 IP loninengpurem51c1.uk.db.com.47259 > fraitdbox01096.de.db.com.snmptrap:  V2Trap(251)  system.sysUpTime.0=1534364676 S:1.1.4.1.0=E:40482.2.50 E:40482.3.1="Flash Array" E:40482.3.2="6.1.14" E:40482.3.3="loninengpurem51-ct1" E:40482.3.4=0 E:40482.3.5="PureStorage Test Trap" E:40482.3.6="PureStorage Test Body" E:40482.3.7=2
14:29:51.687248 IP loninengpurem51c1.uk.db.com.45878 > fraitdbox01096.de.db.com.snmptrap:  V2Trap(251)  system.sysUpTime.0=1534367757 S:1.1.4.1.0=E:40482.2.50 E:40482.3.1="Flash Array" E:40482.3.2="6.1.14" E:40482.3.3="loninengpurem51-ct1" E:40482.3.4=0 E:40482.3.5="PureStorage Test Trap" E:40482.3.6="PureStorage Test Body" E:40482.3.7=2
^C
3 packets captured
6 packets received by filter
0 packets dropped by kernel

**Comment by thezackm** [comment]
@benher-cherla-db - we need the actual `.pcap` file that is saved from the command snippet I shared; it has a ton of detail that the `STDOUT` will be missing.

**Comment by benher-cherla-db** [comment]
Hi Zack Mutchler,

Unable to upload .pcap file seems gibhub doesn't supportit it. It's throws the error " We don't support the file type ".
Would it work if I share the same over email ?

**Comment by thezackm** [comment]
@benher-cherla-db - you can share it as a `.zip` here; sorry I should have mentioned that!

**Comment by benher-cherla-db** [comment]
Hi Zack Mutchler,

I have challenges uploading the file here. Is it OK if I share it over your email ? If yes, please provide your email ID.

**Comment by thezackm** [comment]
received file from account team internally - working this ticket now
